{
  "artifact_dir": "artifacts/s1_closed_shadow_runs/2026-04-30-001",
  "artifacts": [
    {
      "contains_customer_visible_artifact": false,
      "contains_raw_payload": false,
      "contains_secret_or_token": false,
      "file_name": "run_record.json",
      "path": "artifacts/s1_closed_shadow_runs/2026-04-30-001/run_record.json",
      "retain_allowed": true,
      "retention_class": "S1_CLOSED_SHADOW_EVIDENCE_METADATA",
      "sha256": "a229362348df05ef6acaa70a22837e7c967084bb505f26c177f93970e3161b57"
    },
    {
      "contains_customer_visible_artifact": false,
      "contains_raw_payload": false,
      "contains_secret_or_token": false,
      "file_name": "safety_scan.json",
      "path": "artifacts/s1_closed_shadow_runs/2026-04-30-001/safety_scan.json",
      "retain_allowed": true,
      "retention_class": "S1_CLOSED_SHADOW_EVIDENCE_METADATA",
      "sha256": "1feb98bc48a6a9e681f06a2cd3e325e5d3d8d2ba0e7dbd773ea7284f1973cf15"
    },
    {
      "contains_customer_visible_artifact": false,
      "contains_raw_payload": false,
      "contains_secret_or_token": false,
      "file_name": "case_summary.json",
      "path": "artifacts/s1_closed_shadow_runs/2026-04-30-001/case_summary.json",
      "retain_allowed": true,
      "retention_class": "S1_CLOSED_SHADOW_EVIDENCE_METADATA",
      "sha256": "58a2fddfbada698e9215ad61e652bd240d28ed21a9acd1f7fa5525a8e2a9c6af"
    },
    {
      "contains_customer_visible_artifact": false,
      "contains_raw_payload": false,
      "contains_secret_or_token": false,
      "file_name": "final_status.json",
      "path": "artifacts/s1_closed_shadow_runs/2026-04-30-001/final_status.json",
      "retain_allowed": true,
      "retention_class": "S1_CLOSED_SHADOW_EVIDENCE_METADATA",
      "sha256": "45f57750a303b42596ef30eb013b96d30b65759725741c1fa5e8b18d43692690"
    },
    {
      "contains_customer_visible_artifact": false,
      "contains_raw_payload": false,
      "contains_secret_or_token": false,
      "file_name": "RUN_RECORD.md",
      "path": "artifacts/s1_closed_shadow_runs/2026-04-30-001/RUN_RECORD.md",
      "retain_allowed": true,
      "retention_class": "S1_CLOSED_SHADOW_EVIDENCE_METADATA",
      "sha256": "b0c58bcf49626265a89af379145676dcee01d17b1c85035a204e0c2a05b04bd5"
    }
  ],
  "generated_at_utc": "2026-04-30T11:37:45Z",
  "manifest_self": {
    "path": "artifacts/s1_closed_shadow_runs/2026-04-30-001/artifact_manifest.json",
    "sha256": "SELF_REFERENTIAL_HASH_EXCLUDED"
  },
  "schema_version": "secupilot.s1.artifact_manifest.v1"
}
